<?xml version="1.0" encoding="UTF-8"?>
<md:MetaData xmlns:md="http://www.org.osgi/xmlns/metatype/v1.0.0/md" xmlns:xsi="http://www.w3.org/2001/XMLSchema-instance" xsi:schemaLocation="http://www.org.osgi/xmlns/metatype/v1.0.0/md
 metatype.xsd">
	<OCD id="ocd1" name="%Person" description="%Description">
		<AD  id="surName" name="%Surname" type="String" max="24" min="2" default="" required="true"/>
		<AD  id="sex" name="%Sex" type="String" default="" description="%SexDescription" required="false">
			<Option label="%Male" value="male"/>
			<Option label="%Female" value="female"/>
			<Option label="%Yes" value="yes"/>
			<Option label="%No" value="no"/>
		</AD>
		<AD id="familyName" name="%FamilyName" type="String" default="" required="true"/>
		<AD id="age" name="%Age" type="Integer" min="13" max="120" default="18" required="false"/>
		<Icon resource="%Icon" size="16"/>
	</OCD>
	
	<OCD id="ocd2" name="%Object" description="%Description">
		<AD id="boolean" name="%Boolean" type="Boolean" default="false"/>
		<AD id="byte" name="%Byte" type="Byte" default="0"/>
		<AD id="character" name="%Character" type="Char" default="0"/>
		<AD id="double" name="%Double" type="Double" default="1.0"/>
		<AD id="float" name="%Float" type="Float" default="1.0"/>
		<AD id="integer" name="%Integer" type="Integer" default="1"/>
		<AD id="long" name="%Long" type="Long" default="1"/>
		<AD id="short" name="%Short" type="Short" default="1"/>
		<AD id="string" name="%String" type="String" default="test"/>
	</OCD>
	
	<Designate pid="com.acme.ocd1">
		<Object ocdref="ocd1"/>
	</Designate>
	
	<Designate pid="com.acme.ocd2">
		<Object ocdref="ocd2"/>
	</Designate>
</md:MetaData>
